code,ham/spam,message,
1,ham,"Your A/C XXXXX739176 Debited INR 40,000.00 on 12/01/18 -Transferred to SRI KRISHNA MOTOR . A/C Balance INR 61,322.28",
1,ham,"Your A/C XXXXX739176 Cr. INR 2,06,485.00 on 12/01/18 on account of Premature payment of TD A/c XXXXX634339. Download YONO @ www.yonosbi.com",
1,ham,"Your A/C XXXXX739176 Debited INR 4,000.00 on 28/12/17 -Transferred to Mr. RACHURI CHAKRAV. A/C Balance INR 50,183.57",
1,ham,Your A/C XXXXX739176 has a debit by transfer of Rs 12.00 on 14/12/17. Avl Bal Rs 402.57.Download Buddy@ http://goo.gl/qUlXqL,
1,ham,Your AC XXXXX739176 Debited INR 35.40 on 30/11/17 -MAB SB Debit . Avl Bal INR 414.57.Plz download Buddy,
1,ham,"Your A/C XXXXX739176 Debited INR 38,700.00 on 20/07/17 -Transferred to Mr. CHOKKAPU MANOHA. A/C Balance INR 35,518.97",
1,spam,"Hi akash, 500+ New Styles Added in Eyeglasses & Sunglasses! Get Quirky Sunglasses @Rs.169 & Spectacles FRAME for FREE @Coolwinks: https://goo.gl/kbVDan",
1,spam,"Hi akash, Your wallet has been credited with Rs.2000. Get Sunglasses @Rs.169 & Spectacles FRAME for FREE. Valid Only for Today: https://goo.gl/SkjrTS",
1,spam,"Hi akash, Your Rs.2000 wallet bal expires in next 4 Hours! Use your wallet & Get Spectacles FRAME for FREE & Sunglasses @Rs.169: https://goo.gl/8nfUm6",
1,spam,"Hi akash, Your Rs.2000 wallet bal expires in next 4 Hours! Use 100% CoolCash & Get your Spectacles for FREE. Hurry! Buy Now: https://goo.gl/BX6Zi7",
1,spam,"Hi akash, Your Rs.2000 CoolCash expires today! BUY 1 Get 1 FREE on Sunglasses @Rs.499 & Spectacles FRAME for FREE, Lenses @Rs.699: https://goo.gl/E1Reh7",
1,spam,"Hi akash, Buy 2 Sunglasses @Rs.499 & Spectacles FRAME for FREE @Coolwinks Weekend Sale. Use your Rs.3500 wallet bal & save more: https://goo.gl/CZJcqP",
1,spam,"Hi akash, BUY 1 GET 1 FREE on All Brands. Lens starting @Rs.699 & Sunglasses @Rs.499. Use your Rs.3500 wallet bal & save more: https://goo.gl/Mdtwjy",
1,spam,"Hi akash, Your Rs.2500 wallet bal expires in next 5 Hours! Shop Now & Avail BUY 1 GET 1 OFFER on Eyeglasses & Sunglasses: https://goo.gl/eczJw3",
1,spam,"Hi akash, Your Rs.2500 wallet bal expires in next 6 Hours! Use your wallet & Get Spectacles FRAME for FREE & Sunglasses @Rs.499: https://goo.gl/v4eVMR",
1,spam,"Hi akash, 2500 credited for Valentine's Week! Updated wallet bal is Rs.4000. Get Spectacles FRAME for FREE & Sunglasses @Rs.499: https://goo.gl/5YhAJr",
1,spam,"Hi akash, Your Rs.2000 wallet bal expires in next 9 Hours! Last Chance to Get Spectacles FRAME for FREE & Sunglasses @Rs.499: https://goo.gl/63JERD",
1,spam,"Use CoolCash & Get FLAT 75% OFF. 75% valid from 12 to 4 PM, 65% valid from 4 to 6 PM, 50% valid from 6 to 8 PM, 8 to 12 AM 30%. Buy Now: https://goo.gl/ANmhQx",
1,spam,"Hi akash, Use Code: CW8492828 & Get FLAT 50% OFF on Eyeglasses & Sunglasses @Coolwinks. Code expires in next 3 Hours. Hurry! Buy Now: https://goo.gl/uUGQHj",
1,spam,"Hi akash, Rs.1500 credited in your wallet! Updated bal is Rs.3000. Pay Rs.0 on your FIRST FRAME. Offer valid for Next 48 Hours: https://goo.gl/29RASD",
1,spam,"Hi akash, Rs.2000 credited in your wallet. Updated bal is Rs.3500. Get Spectacles FRAME for FREE* & Sunglasses starting @Rs.499: https://goo.gl/NXFbMU",
1,spam,"Hi akash, 100% Cashback Offer! Spectacles FRAME is FREE. Pay using CoolCash & Get Anti Glare Lenses at just Rs.400. Buy Now: https://goo.gl/kQEMkB",
1,spam,"Hi akash, Your Rs.1500 CoolCash expires in next 8 Hours! Get Spectacles FRAME for FREE* & Sunglasses starting @Rs.499. Buy Now: https://goo.gl/Wma4LJ",
1,spam,"Hi akash, Shop Sunglasses starting @Rs.499 & Spectacles FRAME for FREE, Pay Only for Lenses. Order Now & Get EXTRA 50% Cashback: https://goo.gl/43GbQL",
1,spam,"Hi akash, BUY 1 GET 1 FREE on Spectacles & Sunglasses starting at Rs.499 @Coolwinks. Use your Rs.6500 wallet bal & save more: https://goo.gl/RFKcDH",
1,spam,"Hi akash, Republic Day Special! Get Spectacle FRAME for FREE* & Sunglasses starting @Rs.499. Use ur Rs.6500 CoolCash & save more: https://goo.gl/viK4ef",
1,spam,"Hi akash, Rs.5000 credited in your wallet! Updated bal is Rs.6500. Get Spectacles FRAME for FREE* & Sunglasses starting @Rs.499: https://goo.gl/9c5bPa",
1,spam,"Hi akash, BIG SALE IS BACK! Get Spectacles FRAME for FREE*, Pay Only for Lenses & Shop Sunglasses starting @Rs.499 @Coolwinks: https://goo.gl/w2Fipy",
1,spam,"Hi akash, Rs.3000 credited in your wallet. Updated bal is Rs.4500. Get Spectacles FRAME for FREE* & Sunglasses starts @Rs.499: https://goo.gl/aHYiTu",
1,spam,"Hi akash, Get Spectacle FRAME for FREE* & Sunglasses starting @Rs.499. Use your Rs.4000 wallet bal & save upto Rs.1500. Buy Now: https://goo.gl/c4M4ag",
1,spam,"Hi akash, Your Rs.2500 wallet bal expires today! Activate your wallet & Get Eyeglasses for FREE*, Old Price 4650, New Price 0: https://goo.gl/jCBLe4",
1,spam,"Hi akash, Sure-shot way to Save Money! Use ur Rs.2500 wallet bal & Get FRAME for FREE*, Pay Only for Lenses @Coolwinks. Buy Now: https://goo.gl/aHfZEM",
1,spam,"Hi akash, Rs.2500 credited in ur wallet! Updated bal is Rs.4000. Get Premium Eyeglasses for FREE*, Old Price 4650, New Price 0: https://goo.gl/uovqQX",
1,spam,"Hi akash, Your Rs.1500 wallet bal expires today! Activate your wallet & Get FRAME for FREE*, Lens package starts at Rs.700: https://goo.gl/XU5xpk",
1,spam,"Hi akash, Big Sale is BACK! Sunglasses starting @Rs.499 & FRAME is FREE* @Coolwinks. Use your Rs.1500 wallet bal & save more: https://goo.gl/PL3bno",
1,spam,"Hi akash, Rs.1500 credited in your wallet as New Year Gift! Get your FRAME for FREE, Pay Only for Lenses @Coolwinks Sale: https://goo.gl/2Jh6Uk",
1,spam,"Hi akash, Rs.3000 wallet bal expires in next 3 Hours! Use your wallet & save upto Rs.2500 on Eyeglasses & Sunglasses @Coolwinks: https://goo.gl/1gzm7y",
1,spam,"Hi akash, Rs.3000 wallet bal expires today! Activate ur wallet & make ur Christmas more Merrier by saving upto Rs.2500 @Coolwinks: https://goo.gl/n9cNuc",
1,spam,"Hi akash, Rs.3000 wallet bal expires in next 48 Hours! Get FRAME for FREE, Pay Only for Lenses & Sunglasses starting at Rs.499: https://goo.gl/x9YNuL",
1,spam,"Hi akash, Santa has credited Rs.3000 in your wallet. Updated bal is Rs.3000. Buy 2 Eyeglasses with Anti-Glare Lenses @Rs.1890: https://goo.gl/Zu11UF",
1,spam,"Hi akash, Congratulations! Rs.2500 credited in your wallet. Updated bal is Rs.2500. Get FRAME for FREE, Pay Only for Lenses: https://goo.gl/xkUroF",
1,spam,"Hi akash, Rs.2500 credited in your wallet. Updated bal is Rs.2500. Get Eyeglass FRAME for FREE* & Sunglasses starting @Rs.499: https://goo.gl/BqjdAK",
1,spam,"Hi akash, Your Rs.2500 wallet bal expires in next 4 Hours! Use your wallet & Get FRAME for FREE, Pay Only for Lenses @Coolwinks: https://goo.gl/Lu9aor",
1,spam,"Hi akash, Rs.2500 credited in your account. Updated bal is Rs.2500. Activate your wallet & save upto Rs.1500 on Eyeglasses : https://goo.gl/1x3myi",
1,spam,"Hi akash, Don't let your Rs.2500 wallet bal expire. Activate your wallet & Get FRAME for FREE, Pay Only for Lenses @Coolwinks: www.gs.im/m/?t=WgdwOzjjOiG",
1,spam,"Hi akash, Rs.2500 credited in your wallet. Updated bal is Rs.2500. Get your FRAME for FREE, Pay Only for Lenses @Coolwinks: https://goo.gl/HVcyyM",
1,spam,"Hi akash, Get Frame for FREE, Pay Only for Lenses & Avail Buy 1 Get 1 Offer on Sunglasses. Use code EXTRA10 & Get Extra 10% OFF: https://goo.gl/ggc1PY",
1,spam,"Hi akash, Rs.2500 wallet bal expires in next 3 Hours! Activate your wallet & Get FRAME for FREE, Pay Only for Lenses @Coolwinks: https://goo.gl/2MYwaz",
1,spam,"Hi akash, Rs.1500 credited in your wallet. Updated bal is Rs.1500. Activate ur wallet & Get 2 Eyeglasses with Lenses @Rs.1450: https://goo.gl/i6epSW",
1,spam,"Hi akash, Final Reminder! Your Rs.2500 wallet bal expires in next 3 Hours. Get Frame for FREE, Pay Only for Lenses @Coolwinks: https://goo.gl/gW382z",
1,spam,"Hi akash, Get ur Frame for FREE, Pay Only for Lenses @Coolwinks. Pay using CoolCash & save upto Rs.1500. Offer expires tomorrow: https://goo.gl/PpYpMH",
1,spam,"Hi akash, Your Rs.1500 wallet bal expires in next 3 Hours! Activate your wallet & Get Frame for FREE. Hurry! Buy Now : https://goo.gl/iJJTBA",
1,spam,"Hi akash, Your Rs.1500 wallet bal expires today. Activate your wallet & Get 2 Eyeglasses with Lenses @Rs.1299. Activate Now: https://goo.gl/5rEQjT",
1,spam,"Hi akash, Rs.1000 just got credited in ur account. Wallet bal is Rs.1000. Activate ur wallet & save upto Rs.1500 @Coolwinks : https://goo.gl/VVW4tc",
1,spam,"Hi akash, Rs.1000 just got credited in your Wallet. Expires Tonight. Buy 2 Eyeglasses with Lenses @Rs.1299 at Coolwinks: https://goo.gl/n7k4s9",
1,spam,"Hi akash, Rs.1000 wallet bal expires in Next 8 Hours! Activate your wallet & Shop Eyeglasses & Sunglasses @Coolwinks. Shop Now: https://goo.gl/YaeDHT",
1,spam,"Hi akash, Rs.1000 wallet bal expires in next 3 Hours! Activate ur wallet & Avail FREE FRAME OFFER on Eyeglasses, Pay Only for Lenses: https://goo.gl/KAQ55r",
1,spam,"Hi akash, Buy 2 Eyeglasses with Lenses at just Rs.1299 @Coolwinks Diwali Sale. Pay using 100% CoolCash & save upto Rs.1500: https://goo.gl/iZU4MV",
1,spam,"Hi akash, Enjoy Pre-Diwali Sale in Style! Buy 2 Eyeglasses with Lenses @Rs.1299. Activate your CoolWallet & Get Extra Rs.300 OFF: https://goo.gl/CRi9Qk",
1,spam,"Hi akash, Get FREE Frames, Pay Only for Lenses starting @Rs.693 Plus Extra Rs.300 CoolCash discount. Offer expires in next 6 Hours: https://goo.gl/n6qQdu",
1,spam,"Hi akash, GRAND DIWALI SALE is HERE! Get Frames for FREE, Pay Only for Lenses starting @Rs.693. Use CoolCash & save upto Rs.1500: https://goo.gl/bpqZPK",
1,spam,"Hi akash,Rs.300 credited in your Coolwallet for Dussehra. Expires in 3 days. Don't wait anymore. Start your festive shopping now. https://goo.gl/gxSxWb",
1,spam,"Hi akash, Buy 2 Eyeglasses with Anti Glare Lenses @Rs.1500 Only. Pay using CoolCash & save upto Rs.1500. Hurry! Shop Now: https://goo.gl/eB4b5G",
1,spam,"Hi akash, Avail Buy 1 Get 1 Offer on Sunglasses, FREE FRAMES, Pay Only for Lenses @Coolwinks. Pay using CoolCash & save upto Rs.1500: https://goo.gl/fmhbBw",
1,spam,"Hi akash, Get Frames for FREE, Pay Only for Lenses @Coolwinks Sale. Activate your CoolWallet & Get Rs.200 CoolCash instantly - https://goo.gl/8LRi23",
1,spam,"Hi akash, Special Offer, Only for You! Use 100% CoolCash & Save Rs.1500 more on Eyeglasses & Sunglasses @Coolwinks. Hurry! Buy Now - http://bit.ly/2vRkQWZ",
1,spam,"Hi akash, Special Offer for You! Get Eyeglass Frames for Free, Pay Only for Lenses @Coolwinks. Use CoolCash & Get Extra Rs.1000 OFF: http://bit.ly/2vPv2yy",
1,spam,"Hi akash,Your wallet bal Rs.2500 expires today.Use 100% CoolCash before it expires & save upto Rs.1000 on ur next buy.Shop Now-http://bit.ly/2w25NuJ",
1,spam,"Hi akash,Your wallet bal Rs.2500 expires in 2 days.Use 100% CoolCash before it expires & save upto Rs.1000 on ur next buy.Shop Now-http://bit.ly/2w25NuJ",
1,spam,Save Rs.1000 more @Coolwinks! Pay 100% using CoolCash on ur 1st Buy & 40% on ur 2nd Buy. Shop Now & Avail Buy 1 Get 1 Offer on Sunglasses- http://bit.ly/2uOaue8,
1,spam,BIG SALE IS BACK! Pay 100% using CoolCash & Get Extra Rs.1000 OFF @Coolwinks. Get Free Frames & BOGO Offer on Sunglasses. Hurry! Buy Now - http://bit.ly/2fJpt24,
1,spam,Surprise! Save Rs.800 more on your 1st Buy @Coolwinks. Shop your favorite Eyewear & Pay via CoolCash. 1 CoolCash = 1 INR. Hurry! Buy Now - http://bit.ly/2vAhxH0,
1,spam,Sale is BACK! Pay using CoolCash on ur 1st Buy & Save Rs.700. 1 CoolCash = 1 INR. No Minimum Buy Condition. Shop Eyeglasses & Sunglasses - http://bit.ly/2v4WgCo,
1,spam,LAST CHANCE! Pay using 100% CoolCash on your first Coolwinks order. 1 CoolCash = 1 INR. Offer Ends Today. Shop your favourite Eyewear now- http://bit.ly/2uzEny9,
1,spam,Pay using 100% CoolCash on your first Coolwinks order & save UPTO Rs.1000. 1 CoolCash = 1 INR. Hurry! Shop your favourite Eyewear Now - http://bit.ly/2tm1pnh,
1,spam,3 Days FREE SHOPPING at CENTRAL. Last day today! Also redeem Rs200 Free Credit on Central Wallet by Future Pay. Don't miss it! Pls ignore if redeemed. TnC,
1,spam,Preview of 3 Days FREE SHOPPING at CENTRAL Today + Redeem the Rs.200 Free Credit on Central Wallet. See you at CENTRAL. TnC,
1,spam,"Exclusive Preview of 3 Days FREE SHOPPING at CENTRAL Tomorrow.
 
 Shop Rs6000 MRP, Pay only Rs3000 & Get Rs3000 Back as wallet credit.
 
 Also redeem the Rs.200 Free Credit on Central Wallet. See you at CENTRAL. TnC",
1,spam,"3 Days Free Shopping at CENTRAL frm Aug 4-6.
 Special Preview Tomorrow. Last few hrs to Register!
 Give missed call @ 08045300051 for special offer & details. TnC",
1,spam,3 Days Free Shopping at CENTRAL frm Aug 4-6. Special Preview on Aug 3. Last 2 days to Register! Give missed call @ 08045300051 for special offer & details. TnC,
1,spam,"3 Days Free Shopping at CENTRAL frm Aug 4-6. Special Preview on Aug 3. 
 Register Now by missed call at 08045300051 for a special offer & know more details! TnC",
1,ham,"Out for Delivery: Sennheiser CX213 Wired... with tracking ID FMPC0235838887 from flipkart.com, will be delivered before 7pm today by an EKART Wish Master (call 09708023000, PIN 146). Please pay Rs.699.0 by cash only.",
1,ham,"Delivered: Flipkart SmartBuy Wire... with tracking ID FMPC0220790316 from flipkart.com was delivered, today. Click to give feedback: http://ekrt.in/iH65h!NNNN .",
1,ham,"Sorry, our E-Kart executive was not able to reach you on phone for shipment FMPC0220790316 . Please reach out to the executive on 09708023000 with pin 134 -valid only for today",
1,ham,"Shipped: Your Sennheiser CX213 Wired... with order id OD110284976196256000 has been shipped and will be delivered by Wednesday, Sep 27, 2017. You will receive another SMS when the Wishmaster is out to deliver it. Track your shipment here http://fkrt.it/1uzV6!NNNN",
1,ham,"Order Received: We have received your order for Flipkart SmartBuy Wire... with order id OD109790121608205000 amounting to Rs.1599. You can expect delivery by Mon 31, Jul 2017. You can manage your order at http://fkrt.it/OlU5s!NNNN .",
1,spam,Your unutilized cashback of Rs. 100 of December has expired and has been debited from your account. Your current Future Pay wallet balance is Rs. 0.00,
1,spam,"Big Bazaar presents Public Holiday Sale (22-25 Dec) - Get Upto 60% off on your shopping
 
 Redeem Rs.100 CASH in your Future Pay wallet & save more! TnC",
1,spam,"Rs.100 CASH has been added in your Future Pay Wallet to shop at Big Bazaar Public Holiday Sale 22-25 Dec
 
 CASH expires 25 Dec
 
 T&C @ smarturl.it/TandC",
1,spam,"Last 2 Days of Big Bazaar Mahabachat
 
 Shop the best offers + Get Rs.500 CASHBACK on shopping of Rs.2000
 
 T&C-Cashback in Future Pay Wallet. More @ goo.gl/Hdmj13",
1,spam,"Rs. 200 is credited to your Fynd account! *Expires in 3 hours
 Earn 3x when you refer your friends & family! Upto Rs. 10,000!
 https://go.fyndi.ng/bs",
1,spam,"CRAZY DEAL ALERT!
 
 Redeem 60% Fynd cash (No Min. Order Value!) *Between 8-8:30PM
 
 Get ready and start referring!
 
 https://go.fyndi.ng/suw",
1,spam,"Redeem 50% Fynd Referral Cash Today!
 Use your Fynd Bal. Rs.200
 Get add. 15% SUPERCASH on Mobikwik
 https://go.fyndi.ng/dmij",
1,spam,"Rs. 200 credited to your Fynd Cash.*Expires in 3 Hours
 Total Bal: Rs. 200
 Get 15% SUPERCASH on Mobikwik
 https://go.fyndi.ng/bsd",
1,spam,"Akash, Rs. 100 is added in your Fynd Cash account (Expires soon).
 
 Use Code: FIRST20 get EXTRA 20% OFF.
 
 Visit: http://go.fyndi.ng/wlfc",
1,spam,You have Rs.2000 in your goCash wallet. Download the goibibo app or sign up to claim and save on your travel bookings. https://go.ibi.bo/W1ad/mFFxllEs1G,
1,spam,You have Rs.2000 in your goCash wallet. Download the goibibo app or sign up to claim and save on your travel bookings. https://go.ibi.bo/W1ad/4huaxKwq1G,
1,spam,Get cheapest flight guaranteed & 24*7 support with easy web checkin. Download now & complete your flight booking with Haptik. http://get.haptik.ai/now,
1,ham,Thanks for registering with Paytm! Click the link to set your password https://a.p-y.tm/s2lcjp5t57kl27e,
1,ham,"We have received a Paytm login request from a new phone at 09:25 AM, 20 July.If you did not attempt this, please raise a query at paytm.com/care or call us at 0120-38883888",
1,ham,Use 436451 as your login OTP. OTP is confidential. Paytm never calls you asking for OTP. Sharing it with anyone gives them full access to your Paytm Wallet.,
1,ham,Dear P akash We are cancelling your service request as the product is still not dropped by you in our service center. Please reach out to smart buy helpline no 080 41609211 for further assistance. Thank you !,
1,spam,"Lenskart misses you!
 Get FLAT 30% off over and above all offers on Premium John Jacobs Eyewear
 Coupon: JJ30-H4UQH1
 Offer valid for today only at lenskart.com/jj",
1,spam,They're back - Buy 2 Classic eyeglasses for Rs 2500. Fresh styles added this week at w.lenskart.com/s/aMV23m/tg1KHu Optout LENS 567678,
1,spam,"Lenskart's Buy1 Get1 gets sweeter
 Extra Rs 1000 off over this weekend
 Code: Grand1000
 Visit w.lenskart.com/s/ig2O3r/THusux",
1,spam,"Rush Hour Sale Tonight. Be the first to save. Get 20% from 10-11 PM, 15% from 11-12 Midnight & 10% from 12-1 AM. Time is running out lenskart.com/grand",
1,spam,Introducing Katrina Kaif for Lenskart. Watch Katrina try latest styles: lenskart.com/kat | Last few hours of BIG DIWALI SALE. Upto 1000 OFF. Voucher DIWALI1000,
1,spam,Its raining offers this Weekend with Buy1 Get 1 FREE on Eyeglasses with Anti-glare lenses at w.lenskart.com/s/t16FAK/t1Uysr Optout sms LENS 567678,
2,ham,"करें शादी सादगी से, दहेज़ दें सिर्फ विद्या का। बेटी बचाओ, बेटी पढ़ाओ।",
1,ham,Ten 1 @ Rs60 PM dropped. Current a/c Bal: Rs .35. Due date: 07-Jan-19. New monthly charges: Rs 0. Base Pack renewal date:08-Jan-19,
1,ham,"Dear Subscriber, thank you for calling Tata Sky. If you are satisfied with your last interaction, please give a missed call on 09287192871 and if not satisfied, then give a missed call on 09287092870. This is only for feedback purpose",
1,spam,Watch PM Modi's address to the nation & share your thoughts with him directly on MyGov or App http://pmapp.nic.in/m.jsp?6984830759,
1,ham,"Your Ola account was logged into from a new device
 Login: Ola Cabs android app
 Time: 05:27PM, 30 Jan 2018
 Place: Patna
 If you find this suspicious, secure your account by clicking here http://olaca.bs/yjdcWrtL2H",
1,ham,DO NOT SHARE: 9919 is the OTP for your OlaCabs account. Keep this OTP to yourself for the safety of your account.,
1,ham,You've received Rs.75 cashback from PhonePe into your wallet for 50% Cashback on your First UPI transaction(up to Rs.75). Current wallet balance is Rs.75,
1,ham,You've sent Rs.50000 to CHANDRA MOWLISWARARAO via PhonePe from your bank a/c.,
1,spam,Grab Rs. 5 Paytm Cash FREE! Click here https://goo.gl/TdWnef Play & you could win Rs. 5 Paytm Cash Instantly! Valid for first time players only,
1,spam,Did you know RailYatri delivers fresh hot food to your seat in train? To order call at 91- 8137813700 or visit http://bit.ly/2j552yz,
1,ham,Your a/c no. XXXXXXXX9176 is credited by Rs.2000.00 on 02-01-18 by a/c linked to mobile 9XXXXXX085-B BALAJI (IMPS Ref no 800220455415). Download YONO @ www.yonosbi.com.,
1,ham,"Dear Investor, Your Folio No. 19561520 has been created in SBI Mutual Fund. Request you to click on https://www.camsonline.com/InvestorServices/COL_InvestorDataCorrection.aspx?iGL45CVyE%2fH3CIP4J5davIv0bqGNwZHv%2bXYt4CnVcPoJivI%2f6pHASs6pm63ALULytowd52qS9WJSbpoccyQ2T0gjMokcPAspsdfCPZf67iBN3zLRRrpDkvsrkcLF6rJp to verify and update your details - SBIMF",
1,ham,"Your Statement of Account for recent transaction in Folio No.XXXXX520 with SBI Mutual Fund is available in the below link. Pl. click the below link (valid for 5 days) and enter your PAN in CAPITALS; in case PAN is not registered in the Folio, enter your Folio No to download the Statement of Account. www.camsonline.com/dnldresult.asp?fname=Ls0vijden404332.pdf - SBIMF",
1,ham,"Dear Investor, Your Purchase in Folio no.19561520 in SBI DAF-Series - XXVI Reg - Growth for value date 01-Feb-2018 for value of Rs.1,00,000.00 has been successfully processed and units have been allotted -SBIMF",
1,ham,818057 is your One Time Password for online purchase of Rs 3240.00 at recharge_paytm_PayTM thru State Bank Debit Card ending 7160. Don't share this with anyone,
1,ham,406171 is your One Time Password for online purchase of Rs 36981.29 at NITPATNA thru State Bank Debit Card ending 7160. Don't share this with anyone,
1,ham,808642 is your One Time Password for online purchase of Rs 36981.29 at NITPATNA thru State Bank Debit Card ending 7160. Don't share this with anyone,
1,ham,969828 is your One Time Password for online purchase of Rs 290.00 at PAYTM thru State Bank Debit Card ending 7160. Don't share this with anyone,
1,ham,431932 is your One Time Password for online purchase of Rs 320.00 at Retail_ccavenues_com thru State Bank Debit Card ending 7160. Don't share this with anyone,
1,ham,529884 is your One Time Password for online purchase of Rs 640.00 at Retail_ccavenues_com thru State Bank Debit Card ending 7160. Don't share this with anyone,
1,ham,245470 is your One Time Password for online purchase of Rs 320.00 at Retail_ccavenues_com thru State Bank Debit Card ending 7160. Don't share this with anyone,
1,ham,491538 is your One Time Password for online purchase of Rs 290.00 at recharge_paytm_PayTM thru State Bank Debit Card ending 7160. Don't share this with anyone,
1,ham,608614 is your One Time Password for online purchase of Rs 600.00 at PayTm Mobile Solutio thru State Bank Debit Card ending 7160. Don't share this with anyone,
1,ham,768840 is your One Time Password for online purchase of Rs 290.00 at recharge_paytm_PayTM thru State Bank Debit Card ending 7160. Don't share this with anyone,
1,ham,269174 is your One Time Password for online purchase of Rs 290.00 at PayTm Mobile Solutio thru State Bank Debit Card ending 7160. Don't share this with anyone,
1,ham,899637 is your One Time Password for online purchase of Rs 39055.48 at NITPATNA thru State Bank Debit Card ending 7160. Don't share this with anyone,
1,ham,"Your OTP is 394921 for Setting MPIN to your account, It is valid for next 10 mins, Do not disclose OTP to anyone.Download YONO @ www.yonosbi.com",
1,ham,"Dear SBI UPI User, your account is debited INR 1000.0 on Date 2017-12-26 11:11:32 AM by UPI Ref No 736011905451.Download YONO @ www.yonosbi.com",
1,ham,"Dear SBI UPI User, your account is debited INR 500.0 on Date 2017-12-11 08:10:56 PM by UPI Ref No 734520030694.Download YONO @ www.yonosbi.com",
1,ham,"Dear SBI UPI User, your account is debited INR 150.0 on Date 2017-11-21 10:51:33 AM by UPI Ref No 732510451611",
1,ham,"Dear SBI UPI User, your account is debited INR 150.0 on Date 2017-11-10 12:00:32 PM by UPI Ref No 731412563079",
1,ham,"Dear SBI UPI User, your account is debited INR 52.0 on Date 2017-11-04 04:14:39 PM by UPI Ref No 730816236457",
1,ham,"Dear SBI UPI User, your account is debited INR 52.0 on Date 2017-11-03 07:08:18 PM by UPI Ref No 730719560526",
1,ham,"Dear SBI UPI User, your account is debited INR 560.0 on Date 2017-10-26 06:49:24 PM by UPI Ref No 729918805593",
1,ham,"Dear SBI UPI User, your account is debited INR 563.0 on Date 2017-10-18 08:37:44 PM by UPI Ref No 729120201271",
1,ham,"Dear SBI UPI User, your account is debited INR 500.0 on Date 2017-10-09 12:20:12 PM by UPI Ref No 728212893324",
1,ham,"Dear SBI UPI User, your account is debited INR 500.0 on Date 2017-10-09 09:04:43 AM by UPI Ref No 728209869847",
1,ham,"Dear SBI UPI User, your account is debited INR 2000.0 on Date 2017-10-09 09:01:19 AM by UPI Ref No 728209854527",
1,ham,518194 is your One Time Password for online purchase of Rs 700.3 at www.bookmyshow.com thru State Bank Debit Card ending false. Don't share this with anyone,
1,ham,Your internet pack has expired. Dial *111# to buy internet packs.,
1,ham,"Hi, your 3G/4G internet pack is valid for another 3 days and will end on 05.12.2017 23:59:59. Buy a data pack from MyVodafone App (www.vodafone.in/j3) or dial *111*1*5*2#",
1,ham,"Hello, your 2G internet pack is now active & valid till 05.12.2017 23:59:59 .You have 100.00 MB in your account, track usage at www.vodafone.in/j1 or dial *111*2*2#",
1,ham,"Hi, your 3G/4G internet pack is valid for another 3 days and will end on 22.08.2017 23:59:59. Buy a data pack from MyVodafone App (www.vodafone.in/j3) or dial *111*1*5*2#",
1,ham,"Hello, your 2G internet pack is now active & valid till 22.08.2017 23:59:59 .You have 100.00 MB in your account, track usage at www.vodafone.in/j1 or dial *111*2*2#",
1,spam,"Eid costs less@ Vishal Megamart
 5kgRiceFREEon5000
 Rs 30off on 2Real Juice 1l
 B1G1FREE
 ImliTree spices
 LadiesKurta
 Kids Jeans
 TC",
1,ham,Added Rs. 600 to your Paytm wallet. Transaction ID: 13597590666. Current Balance: 600.0. Big Bazaar Mahabachat sale http://m.p-y.tm/D60 .,
1,spam,"Get 18% to 34% extra talktime only with M-Pesa! Everytime Full Talktime on Vodafone Prepaid recharges of Rs.30,40,50 upto Rs.200. Dial *400# now",
1,spam,"Get 18% to 34% extra talktime only with M-Pesa! Everytime Full Talktime on Vodafone Prepaid recharges of Rs.30,40,50 upto Rs.200. Click https://goo.gl/c5kK2k",
2,spam,"Ab har baar Full Talktime sirf M-Pesa se! Rs30,40,50,60,70,80,90,100 ke Vodafone Prepaid recharge par offer uplabdh Dial *400# ya Click https://goo.gl/c5kK2k",
1,spam,Still going to stores for recharges ? Use the M-Pesa app to recharge your Vodafone Prepaid and enjoy10% cashback upto Rs20 T&C apply https://goo.gl/VC4K0k,
1,spam,MakeMyTrip:Upto Rs.60000 Off* on Top Holiday Destinations! Also 15% upto Rs.10000 Cashback on ICICI Bank Credit Cards. Click bit.ly/2ydHONn or Call 18001025500,
